{
  "rules_version": "1.0",
  "target_runtime": "tour_robot",
  "publication_policy": {
    "required_result": "is_publishable",
    "allow_errors": false,
    "allow_warnings": false
  },
  "rules": [
    { "rule_id": "RSF_RULE_SOURCE_POINT_IDS", "category": "input", "severity": "error", "enforcement": "validator", "applies_to": "map_config.yaml:$.points", "requirement": "Preserve every points.json id without invention, renumbering, merging, or omission.", "fix": "Restore physical navigation IDs from the authoritative point export." },
    { "rule_id": "RSF_RULE_SHARED_POSE_IDENTITY", "category": "input", "severity": "error", "enforcement": "agent_review", "applies_to": "points.json", "requirement": "Keep distinct logical points separate even when their coordinates and yaw are equal or near.", "fix": "Confirm every shared-pose point role with the user." },
    { "rule_id": "RSF_RULE_TARGET_FIELDS", "category": "model", "severity": "error", "enforcement": "schema", "applies_to": "*.yaml", "requirement": "Use only fields defined by the bundled tour_robot target schemas.", "fix": "Remove unknown fields or select the real runtime field from the model catalog." },
    { "rule_id": "RSF_RULE_SCENE_IDENTITY", "category": "identity", "severity": "error", "enforcement": "validator", "applies_to": "<scene_id>/", "requirement": "The directory basename and every YAML scene_id must be the same lowercase snake_case value.", "fix": "Rename the directory and align all scene_id values." },
    { "rule_id": "RSF_RULE_EXPLAIN_MAP_REFERENCE", "category": "reference", "severity": "error", "enforcement": "validator", "applies_to": "explain_config.yaml:$.areas.*.points.*", "requirement": "Every Explain Point map_point must exist and its point_id must equal the referenced map point point_id.", "fix": "Use the confirmed logical map key and authoritative physical ID." },
    { "rule_id": "RSF_RULE_SEGMENT_CONTENT", "category": "content", "severity": "error", "enforcement": "validator", "applies_to": "explain_config.yaml:$.areas.*.points.*.segments.*", "requirement": "Every Segment must contain non-empty narration and remain within the configured per-point limit.", "fix": "Restore source-derived content or split it across confirmed Explain Points." },
    { "rule_id": "RSF_RULE_PROGRAM_REFERENCE", "category": "program", "severity": "error", "enforcement": "validator", "applies_to": "scene_config.yaml:$.programs.*.explain_point_keys", "requirement": "Every Program Explain Point key must exist and appear once.", "fix": "Correct the execution list using existing Explain Point keys." },
    { "rule_id": "RSF_RULE_PROGRAM_ORDER", "category": "program", "severity": "warning", "enforcement": "validator", "applies_to": "scene_config.yaml:$.programs.*.explain_point_keys", "requirement": "Place the confirmed welcome point first and farewell point last, preserving the user-confirmed physical visit order.", "fix": "Correct the Program order after user confirmation." },
    { "rule_id": "RSF_RULE_PROGRAM_REACHABILITY", "category": "program", "severity": "warning", "enforcement": "validator", "applies_to": "scene_config.yaml:$.programs", "requirement": "Every intended Explain Point must be reachable through at least one Program.", "fix": "Add unreachable points to the intended Program or remove intentionally unused narration." },
    { "rule_id": "RSF_RULE_PROGRAM_PHOTO", "category": "program", "severity": "warning", "enforcement": "validator", "applies_to": "scene_config.yaml:$.programs.*", "requirement": "Set a valid confirmed photo_point and never enable photo_before_explain and photo_after_explain together.", "fix": "Use a confirmed map point and one explicit photo policy." },
    { "rule_id": "RSF_RULE_PROGRAM_LIMITS", "category": "program", "severity": "error", "enforcement": "validator", "applies_to": "scene_config.yaml:$.programs.*", "requirement": "Program point count and estimated duration must stay within declared limits.", "fix": "Revise the route or confirm and update the declared limits." },
    { "rule_id": "RSF_RULE_SOURCE_COVERAGE", "category": "content", "severity": "error", "enforcement": "agent_review", "applies_to": "explain_config.yaml", "requirement": "Account for every source section as included, explicitly omitted, or unresolved.", "fix": "Restore omitted source content or obtain explicit approval for omission." },
    { "rule_id": "RSF_RULE_FACT_FIDELITY", "category": "content", "severity": "error", "enforcement": "agent_review", "applies_to": "explain_config.yaml:$.areas.*.points.*.segments.*.content", "requirement": "Preserve names, figures, dates, qualifications, quotations, and conclusions from the source.", "fix": "Correct the narration from exact source references." },
    { "rule_id": "RSF_RULE_NO_INVENTED_BEHAVIOR", "category": "content", "severity": "error", "enforcement": "agent_review", "applies_to": "*.yaml", "requirement": "Do not invent spatial directions, gestures, accessibility, robot capabilities, audiences, or runtime behavior.", "fix": "Remove the invention or obtain authoritative input and confirmation." },
    { "rule_id": "RSF_RULE_PUBLICATION_GATE", "category": "publication", "severity": "error", "enforcement": "policy", "applies_to": "validation result", "requirement": "Declare a scene import-ready only when validation returns is_publishable true with zero errors and zero warnings.", "fix": "Resolve all diagnostics and rerun the complete validation SOP." }
    ,{ "rule_id": "RSF_RULE_FIXED_PERSONAS", "category": "program", "severity": "error", "enforcement": "validator", "applies_to": "reception_pack.yaml:$.personas", "requirement": "Dynamic PAD authoring must expose exactly the nine fixed audiences: government, industry, experts, university, middle_school, primary_school, family_with_child, adult, senior.", "fix": "Use each fixed Persona ID exactly once." }
    ,{ "rule_id": "RSF_RULE_THREE_EXPRESSION_LEVELS", "category": "content", "severity": "warning", "enforcement": "agent_review", "applies_to": "explain_config.yaml:$.areas.*.points.*.segments.*", "requirement": "Keep formal base speech at joke_level 0 and add fact-preserving optional adaptations for relaxed level 1 and humorous level 2 where semantically appropriate.", "fix": "Add or explicitly justify missing expression levels without inventing facts." }
    ,{ "rule_id": "RSF_RULE_FINE_GRAINED_SEGMENTS", "category": "content", "severity": "warning", "enforcement": "validator", "applies_to": "explain_config.yaml:$.areas.*.points.*.segments.*.content and variants.*.content", "requirement": "Keep each spoken base or Variant content within 40 characters and focused on one fact, action, transition, or question.", "fix": "Split long content at natural semantic boundaries while preserving facts, qualifiers, proper nouns, and source order." }
    ,{ "rule_id": "RSF_RULE_DYNAMIC_PAD_OUTPUT", "category": "publication", "severity": "error", "enforcement": "validator", "applies_to": "scene_config.yaml + reception_pack.yaml + explain_config.yaml", "requirement": "Export dynamic authoring configuration for PAD selection instead of fixed audience-specific YAML copies.", "fix": "Enable pad_compiler, include the fixed reception pack, and express variation with conditions and variants." }
    ,{ "rule_id": "RSF_RULE_SOURCE_FACT_BASE", "category": "content", "severity": "error", "enforcement": "agent_review", "applies_to": "base Segment and variants", "requirement": "Anchor each atomic fact in a source-grounded base Segment; variants may polish expression but must remain fact-equivalent.", "fix": "Restore source references and remove unsupported additions from every wording variant." }
  ]
}
